{
  "$schema": "./scenario-schema.v1.json",
  "schemaVersion": "rhymegraph.evaluation-scenarios.v1",
  "datasetId": "rhymegraph-fixture-development",
  "datasetVersion": "1.1.0",
  "split": "development",
  "heldOut": false,
  "judgement": {
    "scale": "0-unrelated_1-usable_2-keep-worthy",
    "reviewerCount": 0,
    "reviewType": "unreviewed-machine-assisted",
    "status": "provisional-development"
  },
  "provenance": "Machine-assisted development fixtures authored from the shipped CMUdict/WordNet pack, authored slang overrides, phrase fixtures, and existing engine examples. Zero human reviewers. Development use only; not independently collected or held out.",
  "scenarios": [
    {
      "id": "dev-full-time",
      "split": "development",
      "category": "full-rhyme",
      "anchor": "time",
      "context": null,
      "pins": [],
      "intent": "continue",
      "dialect": "en-US",
      "expectedAnchorCoverage": true,
      "judgements": [
        { "candidate": "mine", "grade": 2, "relationships": ["full-rhyme"], "rationale": "Exact stressed vowel with a close nasal coda." },
        { "candidate": "rhyme", "grade": 2, "relationships": ["full-rhyme"], "rationale": "Exact /AY M/ rhyme tail." },
        { "candidate": "lime", "grade": 2, "relationships": ["full-rhyme"], "rationale": "Exact /AY M/ rhyme tail." },
        { "candidate": "late", "grade": 1, "relationships": ["slant"], "rationale": "Related diphthong shape with a changed coda." },
        { "candidate": "table", "grade": 0, "relationships": [], "rationale": "Initial spelling overlap does not create a useful ending." }
      ]
    },
    {
      "id": "dev-full-cat",
      "split": "development",
      "category": "full-rhyme",
      "anchor": "cat",
      "context": null,
      "pins": [],
      "intent": "continue",
      "dialect": "en-US",
      "expectedAnchorCoverage": true,
      "judgements": [
        { "candidate": "hat", "grade": 2, "relationships": ["full-rhyme"], "rationale": "Exact /AE T/ rhyme tail." },
        { "candidate": "bat", "grade": 2, "relationships": ["full-rhyme"], "rationale": "Exact /AE T/ rhyme tail." },
        { "candidate": "cut", "grade": 1, "relationships": ["consonance", "slant"], "rationale": "The final /T/ lands while the vowel moves." },
        { "candidate": "dog", "grade": 0, "relationships": [], "rationale": "No useful vowel or coda relationship." },
        { "candidate": "music", "grade": 0, "relationships": [], "rationale": "Unrelated stress and rhyme tail." }
      ]
    },
    {
      "id": "dev-full-flow",
      "split": "development",
      "category": "full-rhyme",
      "anchor": "flow",
      "context": null,
      "pins": [],
      "intent": "continue",
      "dialect": "en-US",
      "expectedAnchorCoverage": true,
      "judgements": [
        { "candidate": "glow", "grade": 2, "relationships": ["full-rhyme"], "rationale": "Exact open /OW/ rhyme." },
        { "candidate": "snow", "grade": 2, "relationships": ["full-rhyme"], "rationale": "Exact open /OW/ rhyme." },
        { "candidate": "show", "grade": 2, "relationships": ["full-rhyme"], "rationale": "Exact open /OW/ rhyme." },
        { "candidate": "go", "grade": 2, "relationships": ["full-rhyme"], "rationale": "Exact open /OW/ rhyme despite different onset." },
        { "candidate": "yeah", "grade": 0, "relationships": [], "rationale": "Open ending alone is not sufficient." }
      ]
    },
    {
      "id": "dev-full-light",
      "split": "development",
      "category": "full-rhyme",
      "anchor": "light",
      "context": null,
      "pins": [],
      "intent": "continue",
      "dialect": "en-US",
      "expectedAnchorCoverage": true,
      "judgements": [
        { "candidate": "night", "grade": 2, "relationships": ["full-rhyme"], "rationale": "Exact /AY T/ rhyme tail." },
        { "candidate": "life", "grade": 1, "relationships": ["assonance", "slant"], "rationale": "Strong /AY/ vowel with a changed final consonant." },
        { "candidate": "late", "grade": 1, "relationships": ["consonance", "slant"], "rationale": "Final /T/ and diphthong movement make a usable slant." },
        { "candidate": "dog", "grade": 0, "relationships": [], "rationale": "Unrelated rhyme tail." }
      ]
    },
    {
      "id": "dev-full-verse",
      "split": "development",
      "category": "full-rhyme",
      "anchor": "verse",
      "context": null,
      "pins": [],
      "intent": "continue",
      "dialect": "en-US",
      "expectedAnchorCoverage": true,
      "judgements": [
        { "candidate": "curse", "grade": 2, "relationships": ["full-rhyme"], "rationale": "Exact /ER S/ rhyme tail." },
        { "candidate": "worse", "grade": 2, "relationships": ["full-rhyme"], "rationale": "Exact /ER S/ rhyme tail." },
        { "candidate": "nurse", "grade": 2, "relationships": ["full-rhyme"], "rationale": "Exact /ER S/ rhyme tail." },
        { "candidate": "force", "grade": 1, "relationships": ["consonance", "slant"], "rationale": "The /R S/ ending is preserved while the vowel changes." },
        { "candidate": "table", "grade": 0, "relationships": [], "rationale": "No meaningful tail relationship." }
      ]
    },
    {
      "id": "dev-pivot-flame",
      "split": "development",
      "category": "pivot",
      "anchor": "flame",
      "context": "Leave the obvious flame/frame pair and open a neighbouring sound family",
      "pins": [],
      "intent": "pivot",
      "dialect": "en-US",
      "expectedAnchorCoverage": true,
      "notes": "Grades are Pivot-specific: an exact repetition is intentionally unsuitable.",
      "judgements": [
        { "candidate": "plain", "grade": 2, "relationships": ["assonance", "slant", "sound-pivot"], "rationale": "Keeps /EY/ while opening a distinct nasal family." },
        { "candidate": "late", "grade": 2, "relationships": ["assonance", "slant", "sound-pivot"], "rationale": "Keeps the vowel family while moving decisively to a /T/ landing." },
        { "candidate": "foam", "grade": 1, "relationships": ["consonance", "slant", "sound-pivot"], "rationale": "Keeps final /M/ while moving to a neighbouring diphthong." },
        { "candidate": "frame", "grade": 0, "relationships": ["full-rhyme"], "rationale": "Excellent rhyme, but too close for the stated Pivot intent." },
        { "candidate": "dog", "grade": 0, "relationships": [], "rationale": "Too remote to function as a recognisable pivot." }
      ]
    },
    {
      "id": "dev-assonance-vibe",
      "split": "development",
      "category": "assonance",
      "anchor": "vibe",
      "context": null,
      "pins": [],
      "intent": "continue",
      "dialect": "en-US",
      "expectedAnchorCoverage": true,
      "judgements": [
        { "candidate": "tribe", "grade": 2, "relationships": ["full-rhyme"], "rationale": "Exact /AY B/ rhyme tail." },
        { "candidate": "live", "grade": 1, "relationships": ["assonance", "slant"], "rationale": "The /laiv/ pronunciation supplies strong /AY/ assonance." },
        { "candidate": "time", "grade": 1, "relationships": ["assonance", "slant"], "rationale": "Shared stressed /AY/ keeps it usable." },
        { "candidate": "drip", "grade": 0, "relationships": [], "rationale": "Spelling resemblance does not survive pronunciation." },
        { "candidate": "dog", "grade": 0, "relationships": [], "rationale": "Unrelated rhyme tail." }
      ]
    },
    {
      "id": "dev-consonance-hand",
      "split": "development",
      "category": "consonance",
      "anchor": "hand",
      "context": null,
      "pins": [],
      "intent": "continue",
      "dialect": "en-US",
      "expectedAnchorCoverage": true,
      "judgements": [
        { "candidate": "land", "grade": 2, "relationships": ["full-rhyme"], "rationale": "Exact /AE N D/ rhyme tail." },
        { "candidate": "band", "grade": 2, "relationships": ["full-rhyme"], "rationale": "Exact /AE N D/ rhyme tail." },
        { "candidate": "bond", "grade": 1, "relationships": ["consonance", "slant"], "rationale": "The /N D/ coda is preserved under a vowel change." },
        { "candidate": "bend", "grade": 1, "relationships": ["consonance", "slant"], "rationale": "The /N D/ coda is preserved under a vowel change." },
        { "candidate": "music", "grade": 0, "relationships": [], "rationale": "No useful ending relationship." }
      ]
    },
    {
      "id": "dev-consonance-love",
      "split": "development",
      "category": "consonance",
      "anchor": "love",
      "context": "Love means we serve and rise above",
      "pins": [],
      "intent": "bridge",
      "dialect": "en-US",
      "expectedAnchorCoverage": true,
      "notes": "Grades combine the written context with sound; the current evaluator intentionally measures only the phonetic part.",
      "judgements": [
        { "candidate": "above", "grade": 2, "relationships": ["full-rhyme", "multi-syllabic"], "rationale": "Exact stressed tail and a direct bridge to the upward context." },
        { "candidate": "serve", "grade": 2, "relationships": ["consonance", "slant"], "rationale": "The final /V/ keeps a sound edge while the word completes the context's idea." },
        { "candidate": "dove", "grade": 2, "relationships": ["full-rhyme"], "rationale": "Exact rhyme whose peace association can bridge the love context." },
        { "candidate": "glove", "grade": 1, "relationships": ["full-rhyme"], "rationale": "Strong sound-only continuation with little contextual help." },
        { "candidate": "cat", "grade": 0, "relationships": [], "rationale": "Neither the sound nor the context supplies a useful bridge." }
      ]
    },
    {
      "id": "dev-slant-quiet",
      "split": "development",
      "category": "slant",
      "anchor": "quiet",
      "context": null,
      "pins": [],
      "intent": "continue",
      "dialect": "en-US",
      "expectedAnchorCoverage": true,
      "judgements": [